{
 "burst": "bn151021791",
 "tally": 14,
 "frozen_utc": "2026-08-11 (night shift; BEFORE any fit table opened)",
 "engine": "L18/L19/L20/L26/L27 active",
 "predictions": [
  "Lu+2018-era lag paper (Shao+2017) carrier; harvest exact values at open",
  "P-A: one-break sufficiency baseline (the null streak test)"
 ],
 "harvest_snippets": {
  "Li&Zhang2021": [
   "\u2026n1)n5b0 \u22121 \u223c50 [\u221225 \u223c\u221210, 100 \u223c130] 22 16 150902733 13.568 \u00b1 0.362 (8.32 \u00b1 0.01) \u00d7 10\u22125 (n0)n1n3b0 \u22121 \u223c25 [\u221225 \u223c\u221210, 30 \u223c60] 17 9 151021791 7.229 \u00b1 0.602 (1.23 \u00b1 0.01) \u00d7 10\u22125 n9(na)b1 \u22121 \u223c10 [\u221225 \u223c\u221210, 30 \u223c50] 9 5 160216801 7.677 \u00b1 0.571 (9.90 \u00b1 0.02) \u00d7 10\u22126 (n9)nanbb1\u2026",
   "\u20266 \u00b1 0.01 296/190 \u22122904 \u22122891 150902733 0.128-s 0 \u223c25 137.63 4538 \u00b1 121 0 8.44 \u00b1 0.23 1.67 \u00b1 0.16 3.72 \u00b1 0.80 1794/190 \u22123069 \u22123056 151021791 0.128-s 0 \u223c10 63.15 3672 \u00b1 83 0 0.80 \u00b1 0.05 0.51 \u00b1 0.07 0.82 \u00b1 0.07 96/73 \u22121242 \u22121233 160216801 0.128-s 0 \u223c15 98.56 4676 \u00b1 139 0\u2026",
   "\u20265.62 \u00b1 1.03 \u221297/\u221299 9.79- + 0.61 0.61 0.56- + 0.01 0.01 5601/2.01 (2.05 \u00b1 0.20) \u00d7 10\u22122 14.609 0.87 \u00b1 0.07 161.8 \u00b1 19.8 5366/2.51 151021791(1) 0.797 \u223c7.923 62.48 0 (8.56 \u00b1 1.15) \u00d7 10\u22127 1.52 \u00b1 0.12 \u2212151/\u2212152 (1.62- + 0.06 0.06) \u00d7 101 0.50- + 0.01 0.01 4361/1.99 L L L L\u2026"
  ],
  "Lu2018": [
   "not in sample"
  ],
  "Li2026_tracking": [
   "not in sample"
  ]
 },
 "P0_STATUS": "BLIND_FROZEN",
 "P0_STATUS_RULE": "Codex audit 2026-08-13 D1: blind-prediction scoring MUST accept only BLIND_FROZEN. ARCHIVAL_POSTFIT = predictions rest on a PREVIOUS production run (allowed as prior, disclosed). NONBLIND_CONTAMINATED = this burst's own new fit values were visible at freeze time."
}