{
 "burst": "bn160330827",
 "tally": 19,
 "frozen_utc": "2026-08-11 night shift 2; BEFORE any fit table opened",
 "engine": "L18/L19/L20/L26/L27 active",
 "predictions": [
  "in Bordoloi+2026 IC-candidate selection lineage (snippets)",
  "P-A: hard-alpha regime check"
 ],
 "harvest_snippets": {
  "Li&Zhang2021": [
   "absent"
  ],
  "Lu2018": [
   "absent"
  ],
  "Li2026": [
   "absent"
  ],
  "Bordoloi2026": [
   "absent"
  ]
 },
 "P0_STATUS": "BLIND_FROZEN",
 "P0_STATUS_RULE": "Codex audit 2026-08-13 D1: blind-prediction scoring MUST accept only BLIND_FROZEN. ARCHIVAL_POSTFIT = predictions rest on a PREVIOUS production run (allowed as prior, disclosed). NONBLIND_CONTAMINATED = this burst's own new fit values were visible at freeze time."
}