{
 "burst": "bn170921168",
 "tally": 16,
 "frozen_utc": "2026-08-11 (night shift; BEFORE any fit table opened)",
 "engine": "L18/L19/L20/L26/L27 active",
 "predictions": [
  "Li&Zhang 2021 VIOLATOR; archival BB-leader (5/18, kT~4.4); has notes/literature_tier1 file",
  "P-A: violator prediction as for 150213001",
  "P-B: low-kT class"
 ],
 "harvest_snippets": {
  "Li&Zhang2021": [
   "\u2026(n2)n5b0 \u22121 \u223c25 [\u221240 \u223c\u221210, 40 \u223c100] 21 12 170114917 12.032 \u00b1 1.305 (1.82 \u00b1 0.01) \u00d7 10\u22125 n1(n2)nab0 \u22121 \u223c15 [\u221220 \u223c10, 80 \u223c100] 11 7 170921168 39.361 \u00b1 4.481 (6.56 \u00b1 0.03) \u00d7 10\u22125 (n1)n2n5b0 \u22121 \u223c40 [\u221220 \u223c\u221210, 40 \u223c60] 8 6 171210493 143.107 \u00b1 2.573 (8.08 \u00b1 0.01) \u00d7 10\u22125 n0(n1\u2026",
   "\u2026e peak times are clearly shifted between two different detectors (GRB 081224887, GRB 110721200, GRB 120426090, GRB 160216801, GRB 170921168, and GRB 171210493), indicating that the peaks of the pulses are Table 2 Results of Lightcurve (Pulses) Fitting of Our Sample wit\u2026",
   "\u2026.01 \u00b1 0.12 1671/151 \u22123119 \u22123107 170114917 0.128-s 0 \u223c10 76.96 3269 \u00b1 100 0 2.05 \u00b1 0.14 0.75 \u00b1 0.13 1.33 \u00b1 0.33 261/73 \u22121131 \u22121122 170921168 0.256-s 0 \u223c50 68.47 2975 \u00b1 41 0 4.35 \u00b1 0.25 0.21 \u00b1 0.03 1.11 \u00b1 0.17 241/190 \u22122929 \u22122916 171210493 0.512-s 0 \u223c100 93.34 2798 \u00b1 24\u2026"
  ],
  "Lu2018": [
   "not in sample"
  ],
  "Li2026_tracking": [
   "not in sample"
  ]
 },
 "P0_STATUS": "ARCHIVAL_POSTFIT",
 "P0_STATUS_RULE": "Codex audit 2026-08-13 D1: blind-prediction scoring MUST accept only BLIND_FROZEN. ARCHIVAL_POSTFIT = predictions rest on a PREVIOUS production run (allowed as prior, disclosed). NONBLIND_CONTAMINATED = this burst's own new fit values were visible at freeze time."
}